‾	барзиёд
🎪	сирк, хайма, хаймаи сирк
🚂	буғ, локомотив, муҳаррик, роҳи оҳан, қатора
🚃	вагони роҳи оҳан, мошин, роҳи оҳан, трамвай, троллейбус, электрикӣ, қатора
🚄	роҳи оҳан, синкансен, суръат, қатора, қатораи баландсуръат
🚅	роҳи оҳан, синкансен, суръат, тир, қатора, қатораи баландсуръат бо нӯги тирмонанд
🚆	роҳи оҳан, қатора
🚇️	метро
🚈	метрои сабук, роҳи оҳан
🚉	истгоҳ, роҳи оҳан, қатора
🚊	трамвай, троллейбус
🚝	нақлиёт, якрелса
🚞	куҳ, мошин, роҳи оҳан, роҳи оҳани куҳӣ
🚋	вагони трамвай, мошин, трамвай, троллейбус
🚌	автобус, нақлиёт
🚍️	автобус, автобуси самти муқобил, самти муқобил
🚎	автобус, трамвай, троллейбус
🚐	автобус, микроавтобус
🚑️	мошини ёрии таъҷилӣ, нақлиёт
🚒	мошини боркаш, мошини сӯхторхомӯшкунӣ, муҳаррик, оташ
🚓	мошин, мошини пулис, посбон, пулис
🚔️	аз самти муқобил, мошин, мошини пулис аз самти муқобил, пулис
🚕	нақлиёт, такси
🚖	аз самти муқобил, такси, такси аз самти муқобил
🚗	автомобил, мошин
🚘️	автомобил, автомобили самти муқобил, мошин, самти муқобил
🚙	кроссовер, мошини варзишии ҳамаҷогард, фароғатӣ
🚚	автомобили боркаш, бурдарасонӣ, мошини боркаш
🚛	боркаш, мошини боркаш, нақлиёти боркаш, ним
🚜	нақлиёт, трактор
🏎️	автомобили пойга, мошин, пойга
🏍️	мотосикл, пойга
🛵	муҳаррик, скутер
🚲️	велосипед, дучарха
🛴	ба по задан, самокат, скутер
🚏	автобус, истгоҳ, истгоҳи автобус, истгоҳи автобусҳо
🛣️	роҳ, роҳи автомобилгард, шоҳроҳ
🛤️	роҳи оҳан, қатора
🛢️	нафт, нақора, чалаки нафт
⛽️	газ, истгоҳ, насос, насоси сӯзишворӣ, сӯзишворӣ
🚨	даврзананда, мино, мошин, пулис, рӯшноии мошини пулис, рӯшноӣ
🚥	рӯшноӣ, сигнал, чароғи раҳнамои уфуқӣ, ҳаракат
🚦	рӯшноӣ, сигнал, чароғи раҳнамои амудӣ, ҳаракат
🛑	аломат, аломати "Ист", ист, ҳашткунҷа
🚧	монеа, сохтмон
⚓️	асбоб, киштӣ, лангар
⛵️	баҳр, заврақи бодбондор, киштӣ, курорт, қаиқ
🛶	заврақ, қаиқ
🚤	катери тезгард, қаиқ
🛳️	киштии мусофиркаш, киштӣ, мусофир
⛴️	киштии гузора, мусофир, қаиқ
🛥️	қаиқ, қаиқи муҳаррикдор
🚢	киштӣ, мусофир, қаиқ
✈️	тайёра, ҳавопаймо
🛩️	тайёра, тайёраи хурд, ҳавопаймо
🛫	бақайдгирӣ, парвоз, парвози тайёра, парвозҳо, тайёра, ҳавопаймо
🛬	нишастан, омадаистода, омадан, омадани тайёра, тайёра, ҳавопаймо
💺	курсӣ, ҷои нишаст
🚁	нақлиёт, чархбол
🚟	овеза, роҳи оҳан, роҳи оҳани овезон
🚠	гондола, куҳ, ноқил, фуникулёр
🚡	гондола, мошин, ноқил, трамваи ҳавоӣ, трамвай, ҳавоӣ
🛰️	моҳвора, фазо
🚀	ракета, фазо
🛸	лаълии паррон
🛎️	зангула, зангулаи хизматгори меҳмонхона, меҳмонхона, хизматгори меҳмонхона
⌛️	вақтсанҷ, рег, соати регӣ
⏳️	вақтсанҷ, рег, соати регӣ, соати регӣ бо ҷорӣ шудани рег
⌚️	соати дастӣ, соати деворӣ
⏰	соат, соати зангдор, ҳушдор
⏱️	соати деворӣ, сониясанҷ
⏲️	вақтсанҷ, соати вақтсанҷ, соати деворӣ
🕰️	соати деворӣ, соати сангӣ
🕛️	00, 12, 12:00, дувоздаҳ, соат, соат дувоздаҳ
🕧	12, 12:30, 30, дувоздаҳ, дувоздаҳу сӣ, соат, сӣ
🕐️	00, 1, 1:00, соат, соат як, як
🕜	1, 1:30, 30, соат, сӣ, як, яку сӣ
🕑️	00, 2, 2:00, ду, соат, соат ду
🕝	2, 2:30, 30, ду, дую сӣ, соат, сӣ
🕒️	00, 3, 3:00, се, соат, соат се
🕞	3, 30, 3:30, се, севу сӣ, соат, сӣ
🕓️	00, 4, 4:00, соат, соат чор, чор
🕟	30, 4, 4:30, соат, сӣ, чор, чору сӣ
🕔️	00, 5, 5:00, панҷ, соат, соат панҷ
🕠	30, 5, 5:30, панҷ, панҷу сӣ, соат, сӣ
🕕️	00, 6, 6:00, соат, соат шаш, шаш
🕡	30, 6, 6:30, соат, сӣ, шаш, шашу сӣ
🕖️	00, 7, 7:00, соат, соат ҳафт, ҳафт
🕢	30, 7, 7:30, соат, сӣ, ҳафт, ҳафту сӣ
🕗️	00, 8, 8:00, соат, соат ҳашт, ҳашт
🕣	30, 8, 8:30, соат, сӣ, ҳашт, ҳашту сӣ
🕘️	00, 9, 9:00, нуҳ, соат, соат нуҳ
🕤	30, 9, 9:30, нуҳ, нуҳу сӣ, соат, сӣ
🕙️	00, 10, 10:00, даҳ, соат, соат даҳ
🕥	10, 10:30, 30, даҳ, даҳу сӣ, соат, сӣ
🕚️	00, 11, 11:00, соат, соат ёздаҳ, ёздаҳ
🕦	11, 11:30, 30, соат, сӣ, ёздаҳ, ёздаҳу сӣ
🌑	моҳ, моҳи нав, торик
🌒	калон шудани моҳ, моҳ, ҳилол, ҳилоли нав
🌓	марҳилаи чоряки якуми моҳ, моҳ, чоряк
🌔	калон шудани моҳ, марҳилаи калон шудани моҳ, марҳилаи моҳ, моҳ
🌕️	моҳи пурра, пурра
🌖	марҳилаи моҳ, марҳилаи хурд шудани моҳ, моҳ, хурд шудани моҳ
🌗	марҳилаи чоряки охири моҳ, моҳ, чоряк
🌘	марҳилаи хурд шудани ҳилол, моҳ, хурд шудани моҳ, ҳилол
🌙	моҳ, ҳилол
🌚	моҳ, рӯй, чеҳраи моҳи нав
🌛	моҳ, рӯй, чоряк, чоряки якуми моҳ бо чеҳра
🌜️	моҳ, рӯй, чоряк, чоряки охири моҳ бо чеҳра
🌡️	обу ҳаво, ҳароратсанҷ
☀️	офтоб, офтобӣ, равшан, шуоъ
🌝	моҳ, моҳи пурра бо чеҳра, пурра, равшан, рӯй
🌞	офтоб, офтоб бо чеҳра, равшан, рӯй
⭐️	ситора, ситораи миёнаи сафед
🌟	дурахшидан, дурахшон, пурҷило, ситора, ситораи дурахшон, ялаққос задан
🌠	афтидан, парондан, ситора, ситораи думдор
🌌	роҳи Каҳкашон, фазо
☁️	абр, обу ҳаво
⛅️	абр, офтоб, офтоб паси абр
⛈️	абр, абр бо чароғак ва борон, борон, тундар
🌤️	абр, офтоб, офтоб паси абри хурд
🌥️	абр, офтоб, офтоб паси абри калон
🌦️	абр, борон, офтоб, офтоб паси абри боронӣ
🌧️	абр, абр бо борон, борон
🌨️	абр, абр бо барф, барф, хунук
🌩️	абр, абр бо чароғак, чароғак
🌪️	абр, гирдбод, торнадо
🌫️	абр, туман
🌬️	абр, вазидан, рӯи шамол, рӯй, шамол
🌀	сарчархзанӣ, сиклон, тундбод, туфон
🌈	борон, тирукамон
🌂	борон, либос, чатр, чатри пӯшида
☂️	борон, либос, чатр
☔️	борон, либос, чатр, чатр бо қатраҳои борон, қатра
⛱️	борон, офтоб, чатр, чатр дар замин
⚡️	барқ, хатар, чароғак, шиддат, шиддати баланд, электрикӣ, қувва
❄️	абр, барф, зарраи барф
☃️	абр, барф, одами барфӣ
⛄️	барф, одами барфӣ, одами барфӣ бе барф, хунук
☄️	комета, фазо
🔥	аланга, асбоб, оташ
💧	арақ, мазҳакавӣ, хунук, қатра
🌊	мавҷ, мавҷи об, об, уқёнус
🎃	сурохӣ, хеллоуин, чароғ, чароғак аз каду бо сӯрохиҳои даҳон, бинӣ ва чашмон, ҷашн
🎄	дарахт, дарахти Мавлуди Исо, мавлуди Исо, ҷашн
🎆	оташфаввора, ҷашн
🎇	мушаки маҳтобӣ, оташфаввора, ялаққос задан, ҷашн
✨	ситора, шарора, ялаққос задан
🎈	ҳубоб, ҷашн
🎉	маводи тарфгарӣ (хлопушка), тада, хлопушка, шабнишинӣ, ҷашн
🎊	конфетти, кӯраи конфетти, тӯб, ҷашн
🎋	баннер, дарахт, дарахти Танабата, ҷашн, ҷопонӣ
🎍	бамбук, дарахти санавбаар, ороиши дарахти санавбар, ҷашн, ҷопонӣ
🎎	лухтак, лухтакҳои ҷопонӣ, фестивал, ҷашн, ҷопонӣ
🎏	зағорамоҳӣ, лентаи борик, летнаи ҳиллиросзанандаи ба шакли зағорамоҳӣ, ҷашн
🎐	зангула, мусиқии шамол, мусиқӣ, шамол, ҷашн
🎑	маросим, маросими тамошои моҳтоб, моҳ, ҷашн
🎀	лента, ҷашн
🎁	печондашуда, туҳфа, туҳфаи печондашуда, қуттӣ, ҷашн
🎗️	лента, лентаи ёдрасон, ёдрасон, ҷашн
🎟️	чипта, чиптаҳои қабул, қабул
🎫	чипта, қабул
🎖️	медал, медали ҳарбӣ, ҳарбӣ, ҷашн
🏆️	мукофот, ҷоиза
🏅	медал, медали варзишӣ
🥇	медал, медал барои ҷои 1-ум, тилло, якум
🥈	дуюм, медал, медал барои ҷои 2-юм, нуқра
🥉	биринҷӣ, медал, медал барои ҷои 3-юм, сеюм
⚽️	тӯб, тӯби футбол, футбол
⚾️	бейсбол, тӯб
🏀	баскетбол, тӯб, ҳалқа
🏐	бозӣ, волейбол, саққа
🏈	амрикоӣ, тӯб, футбол, футболи амрикоӣ
🏉	регби, тӯб, футбол
🎾	ракетка, тенис, тӯб
🎳	бозӣ, боулинг, саққа
🏏	бозии крикет, бозӣ, саққо, тӯб
🏑	бозӣ, майдон, майдони хоккей, тӯб, хоккей, чавгон
🏒	бозӣ, хоккей, хоккей дар рӯи ях, чавгон, шайба, ях
🏓	бозӣ, пинг понг, ракетка, саққо, тенниси рӯи миз, тӯб
🏸	бадминтон, бозӣ, волан, ракетка
🥊	бокс, дастпӯшак, дастпӯшак барои бокс
🥋	дзюдо, каратэ, либоси санъати ҳарбӣ, либоси ягона, санъати ҳарбӣ, таэквондо
🥅	гол, тӯри дарвозаи футбол
⛳️	байрақ дар сӯрохӣ, голф, сурохӣ
⛸️	скейт, ях, яхмолак
🎣	моҳӣ, шаст, қутб
🎽	варзиши сабук, давидан, курта, курта барои давидан, тасмаи орден
🎿	барф, лижа
🛷	чана
🥌	бозӣ, санги бозии кёрлинг, харсанг
🎯	бозӣ, буққа, дарт, задан, нишона, рост рафта расидан, чашм, ҳадаф
🎱	8, билярд, билярди 8 саққадор, бозӣ, саққа, ҳашт
🔮	асбоб, афсона, булӯр, кура, кураи булӯрӣ, тахайюлот, тақдир
🎮️	бозии видеоӣ, бозӣ, танзимгар
🕹️	бозии видеоӣ, бозӣ, ҷойстик
🎰	бозӣ, ковокӣ, мошинаи қиморбозӣ
🎲	бозии зарикҳо, бозӣ, зарик, зарикҳо
♠️	бозӣ, корт, қарамашшоқ
♥️	бозӣ, корт, таппон
♦️	бозӣ, корт, хиштхол
♣️	бозӣ, корт, чилликхол
🃏	аломатҳои ивазкунӣ, бозӣ, корт, ҳазлбоз
🀄️	аждаҳори сурхи маҳҷонг, бозӣ, маҳҷонг, сурх
🎴	бозикунӣ, бозӣ, гул, корт, кортҳои бозии "Гул", ҷопонӣ
🎭️	иҷро кардан, намдуҳои санъати иҷро, ниқоб, санъат, театр
🖼️	осорхона, расм, санъат, сурат, сурати чорчӯбадор, чорчӯба
🎨	лавҳачаи рассомии рассом, лавҳачаи рассомӣ, осорхона, расм, санъат
👓️	айнак, айнаки муҳофизатӣ, либос, чашм
🕶️	айнак, айнаки муҳофизатӣ, айнаки офтобӣ, торик, чашм
👔	галстук, пӯшок
👕	курта, либос, футболка
👖	либос, шим, ҷинс
🧣	гардан, шарф
🧤	даст, дастпӯшак
🧥	палто, пиҷак
🧦	ҷуроб, ҷуроби дароз
👗	куртаи занона, пӯшок
👘	кимоно, пӯшок
👙	либоси оббозӣ, оббозӣ кардан, пӯшок
👚	зан, либосҳои занона, пӯшок
👛	либос, танга, ҳамён
👜	либос, сумка, ҳамён
👝	клатч, либос, сумка, сумкача
🛍️	меҳмонхона, сумка, сумкаҳо барои харид кардан, харид
🎒	борхалтаи мактабӣ, мактаб, сумка, ҷузъдон
👞	либос, мард, пойафзол, пойафзоли мардона
👟	варзишӣ, либос, пойафзол, пойафзол барои давидан, пойафзоли варзишӣ
👠	зан, либос, пойафзол, пойафзоли пошнабаланд, пошна
👡	зан, кафши сабук, кафши сабуки занона, либос, пойафзол
👢	ботинка, зан, либос, мӯзаи занона, пойафзол
👑	либос, малика, тоҷ, шоҳ
👒	зан, кулоҳ, кулоҳи занона, либос
🎩	боло, кулоҳ, кулоҳи баланд, либос
🎓️	кепка, конфедератка, кулоҳ, либос, хатм, ҷашн
🧢	бейсболка, кепкаи лапардор
⛑️	кӯмак, рӯй сарпӯш, салиб, тоскулоҳ, тоскулоҳи корманди наҷотдиҳӣ
📿	гарданбанд, дин, дуо, либос, тасбеҳ, шабаи майда
💄	косметика, лабсурхкунак, макияж
💍	алмос, ангуштарин
💎	алмос, нақрасанг, санги қиматбаҳо, ҷавоҳирот
🔇	баландгӯяк, баландгӯяки хомӯш, бесадо кардан, хомӯш
🔈️	мулоим, садои пасти баландгӯяк
🔉	миёна, садои миёнаи баландгӯяк
🔊	баланд, садои баланди баландгӯяк
📢	баланд, баландгӯяк, суроғаи ошкор
📣	кафкӯбӣ, мегафон
📯	почта, почтавӣ, сурнаи почта, сурнай
🔔	зангӯлача
🔕	бесадо, зангула, зангӯлача бо хати каср, мамнуъ, манъшуда, не, хомӯш
🎼	мусиқӣ, нота, партитура
🎵	мусиқӣ, нота, нотаи мусиқӣ
🎶	мусиқӣ, нота, нотаҳо, нотаҳои мусиқӣ
🎙️	мик, микрофон, микрофони студия, мусиқӣ, студия
🎚️	василаи лағжанда, василаи лағжандаи сатҳ, мусиқӣ, сатҳ
🎛️	дастаҳо, дастаҳои идора, идора, мусиқӣ
🎤	караоке, мик, микрофон
🎧️	гӯшмонак, гӯшмонаки хурд
📻️	видео, радио
🎷	асбоб, мусиқӣ, саксофон
🎸	асбоб, гитар, мусиқӣ
🎹	асбоб, клавиатура, клавиатураи мусиқӣ, мусиқӣ, пианино
🎺	асбоб, карнай, мусиқӣ
🎻	асбоб, мусиқӣ, ғиҷҷак
🥁	мусиқӣ, нақора, чӯбҳои нақора
📱	телефон, телефони мобилӣ
📲	занг, телефон, телефони мобилӣ, телефони мобилӣ бо тир, тир, қабул кардан
☎️	телефон
📞	гӯшаки телефон, телефон
📟️	пейҷер
📠	дастгоҳи факс, факс
🔋	батарея
🔌	барқ, барқӣ, васлак, васлаки электрикӣ
💻️	компютер, компютери лэптоп, шахсӣ
🖥️	компютер, компютери рӯимизӣ, рӯимизӣ
🖨️	компютер, принтер
⌨️	клавиатура, компютер
🖱️	компютер, муши компютер
🖲️	компютер, трекбол
💽	диск, диски компютер, компютер, минидиск, оптикӣ
💾	диск, диски нарм, компютер, нарм
💿️	cd, диск, диски оптикӣ, компютер, оптикӣ
📀	blu-ray, dvd, диск, компютер, оптикӣ
🎥	камера, камераи киногирӣ, кино, синамо
🎞️	кадр, кадрҳои навор, кино, навор, синамо
📽️	видео, кино, проектор, проектори филм, синамо, филм
🎬️	кино, нумератор, хлопушка
📺️	видео, тв, телевизор
📷️	видео, камера
📸	видео, дурахш, камера, камера бо дурахш
📹️	видео, видеокамера, камера
📼	видео, видеосистемаи хонагӣ, кассетаи видео, навор
🔍	асбоб, бузургкунӣ, пурбини ба тарафи чап ишоракунанда, шиша, ҷустуҷӯ
🔎	асбоб, бузургкунӣ, пурбини ба тарфи рост ишоракунанда, шиша, ҷустуҷӯ
🕯️	рӯшноӣ, шамъ
💡	барқӣ, идея, мазҳакавӣ, рӯшноӣ, фурӯзонак, чароғак
🔦	асбоб, барқӣ, машъал, рӯшноӣ, фонус
🏮	бар, рӯшноӣ, сурх, чароғ, чароғ аз қозаи сурх
📔	дафтар, дафтар бо муқоваи ороишӣ, китоб, муқова, ороишдода
📕	китоб, китоби пӯшида, пӯшида
📖	китоб, китоби кушода, кушода
📗	китоб, китоби сабз, сабз
📘	кабуд, китоб, китоби кабуд
📙	китоб, китоби норанҷӣ, норанҷӣ
📚️	китоб, китобҳо
📓	дафтар
📒	дафтар, дафтари бухғалтерӣ
📃	саҳифа, саҳифа бо қатшавӣ, қатшавӣ, ҳуҷҷат
📜	навори ҳаракат, қоғаз
📄	саҳифа, саҳифа бо рӯйгардонкунӣ, ҳуҷҷат
📰	газета, хабарҳо, қоғаз
🗞	газета, газетаи гардондашуда, гардондашуда, хабарҳо, қоғаз
📑	аломат, варақаҳо, варақаҳои хатбарак, маркер, хатбарак
🔖	аломат, хатбарак
🏷️	тамға
💰️	доллар, пул, сумка, халтаи пул
💴	асъор, бонк, йен, пул, қоғази пул, қоғази пули йен
💵	асъор, бонк, доллар, пул, қоғази пул, қоғази пули доллар
💶	асъор, бонк, евро, пул, қоғази пул, қоғази пули евро
💷	асъор, бонк, пул, фунт, қоғази пул, қоғази пули фунт
💸	асъор, бонк, пул, пул бо қанотҳо, қанотҳо, қоғази пул
💳️	бонк, корт, корти кредитӣ, пул, қарз
💹	асъор, афзоиш, бозор, боло, боло рафтан, бонк, график, диаграмма, диаграммаи афзоиш бо йен, йен, пул, тамоюл
✉️	лифофа, мактуб, номаи электронӣ
📧	мактуб, номаи электронӣ, почта, почтаи электронӣ
📨	воридшаванда, лифофа, лифофаи воридотӣ, мактуб, номаи электронӣ, почта, почтаи электронӣ, қабул кардан
📩	ирсол шуд, лифофа, лифофа бо тир, мактуб, номаи электронӣ, почта, почтаи электронӣ, поён, содиротӣ, тир
📤️	ирсол шуд, лавҳа, лавҳаи паёмдони баромад, мактуб, паёмдони баромад, почта, қуттӣ
📥️	лавҳа, лавҳаи паёмдони даромад, мактуб, паёмдони даромад, почта, қабул кардан, қуттӣ
📦️	баста, пакет, қуттӣ
📫️	почта, пӯшида, қуттии почта, қуттии почтаи пӯшида бо байрақчаи бардошаташуда
📪️	пастшуда, почта, пӯшида, қутии почтаи пӯшида бо байрақчаи паст кардашуда, қуттии почта
📬️	кушода, почта, қуттии почта, қуттии почтаи кушода бо байрақчаи бардошаташуда
📭️	кушода, пастшуда, почта, қуттии почта, қуттии почтаи кушода бо байрақчаи паст кардашуда
📮	почта, қуттии почта
🗳️	бюллетен, қуттии бюллетенҳо бо бюллетен, қуттӣ
✏️	қалам
✒️	нӯг, нӯги сиёҳ, ручка
🖋️	авторучка, ручка, фаввора
🖊️	ручка, ручкаи саққочадор
🖌️	мӯқаллам, расм
🖍️	пастел
📝	мемо, қалам
💼	ҷузвгир
📁	файл, ҷузвдон, ҷузвдони файлҳо
📂	кушода, кушодани ҷузвдони фалҳо, файл, ҷузвдон
🗂️	корт, нишондиҳанда, тақсимкунандаҳо, тақсимкунандаҳои индекси кортҳо
📅	сана, тақвим
📆	тақвим, тақвими дарондашаванда
🗒️	дафтари ёддошт, дафтари ёддошти печдор, печдор, тавзеҳ
🗓️	дафтари ёддошт, печдор, тақвим, тақвими печдор
📇	индекси корт, картотека, корт, нишондиҳанда
📈	афзоиш, боло, график, диаграмма, диаграммаи афзоишёбанда, тамоюл
📉	график, диаграмма, диаграммаи коҳишёбанда, поён, тамоюл
📊	бар, график, диаграмма, диаграммаи хаттӣ
📋️	ҳофизаи муваққатӣ
📌	сӯзан, тугмачаи сӯзандор
📍	сӯзан, тугмачаи сӯзандор, тугмачаи сӯзандори даврашакл
📎	бандак
🖇️	бандак, бандаки пайвандшуда, пайванд
📏	ҷадвал, ҷадвали рост
📐	маҷмӯъ, секунҷа, ҷадвал, ҷадвали секунҷа
✂️	абзор, буридан, қайчӣ
🗃️	корт, файл, қуттии файли кортҳо, қуттӣ
🗄️	кабинет, кабинети файлҳо, файл, ҳуҷҷатдорӣ
🗑️	сабади партовҳо
🔒️	пӯшида, қулфшуда
🔓️	кушода, кушодан, кушодашуда, қулф
🔏	бо қалам қулф шудааст, махфият, нӯг, ручка, сиёҳӣ, қулф
🔐	бехатар, бо калид қулф шудааст, калид, пӯшида, қулф
🔑	калид, парол, қулф
🗝️	калид, калиди куҳна, куҳна, қулф
🔨	асбоб, болға
⛏️	асбоб, зоғнӯл, саноати куҳӣ
⚒️	асбоб, болға, болға ва зоғнӯл, зоғнӯл
🛠️	асбоб, болға, болға ва калиди гайкатобӣ, калид, калиди гайкатобӣ
🗡️	корд, силоҳ, ханҷар
