‾	барзиёд
👼	афсона, кӯдак, кӯдаки фаришта, малоика, рӯй, тахайюлот
🎅	бобои барфӣ, клаус, мавлуди Исо, падар, санта, ҷашн
🤶	Мавлуди Исо, Хонум Клаус, клаус, модар, хонум, ҷашн
🧙	зани афсунгар, коҳин, марди афсунгар, соҳир, ҷодугар
🧙‍♂	марди афсунгар, марди коҳин, соҳир
🧙‍♀	зани афсунгар, зани коҳин, ҷодугар
🧚	Оберон, Парии бад, Титания, парӣ
🧚‍♂	Оберон, Парии бад, парии мард
🧚‍♀	Титания, парии зан
🧛	Дракула, вампир, вампирҳо
🧛‍♂	Дракула, вампирҳо, мардии вампир
🧛‍♀	вампирҳо, зани вампир
🧜	марди обӣ, парии обӣ, шахси обӣ
🧜‍♂	Самандар, марди обӣ
🧜‍♀	парии обӣ
🧝	пакана, соҳирӣ
🧝‍♂	марди пакана, соҳирӣ
🧝‍♀	зани пакана, соҳирӣ
🧞	ҷин
🧞‍♂	марди ҷин, ҷин
🧞‍♀	зани ҷин, ҷин
🧟	вампирҳо, зомби, мурдаҳои роҳгард
🧟‍♂	вампирҳо, марди зомби, мурдаҳои роҳгард
🧟‍♀	вампирҳо, зани зомби, мурдаҳои роҳгард
💆	паём, рӯй, толор, шахсе, ки паём гирифта истодааст
💆‍♂	мард, марде, ки паём гирифта истодааст, паём, рӯй
💆‍♀	зан, зане, ки паём гирифта истодааст, паём, рӯй
💇	кабинет, мӯйгирӣ, сартарош, шахсе, ки мӯи сарашро гирифта истодааст, ҳусн
💇‍♂	мард, марде, ки мӯи сарашро гирифта истодааст, мӯйгирӣ
💇‍♀	зан, зане, ки мӯи сарашро гирифта истодааст, мӯйгирӣ
🚶	роҳ гаштан, роҳгардӣ, саёҳат кардан, шахсе, ки роҳ гашта истодааст
🚶‍♂	мард, марде, роҳ гашта истодааст, роҳ гаштан, саёҳат кардан
🚶‍♀	зан, зане, роҳ гашта истодааст, роҳ гаштан, саёҳат кардан
🏃	давида истода, марафон, шахсе, ки давида истодааст
🏃‍♂	давида истода, марафон, мард, марде, ки давида истодааст, пойга
🏃‍♀	давида истода, зан, зане, ки давида истодааст, марафон, пойга
💃	зане, зане, ки рақс карда истодааст, рақс кардан
🕺	мард, марде, ки рақс карда истодааст, рақс
🕴️	костюм, мард, марде, ки бо костюми корӣ баланд шуда истодааст, соҳибкорӣ
👯	гӯшҳои харгӯш, нафарони бо гӯшҳои харгӯш хурсандӣ карда истода, раққос, хурсандӣ кардан
👯‍♂	гӯшҳои харгӯш, мардон, мардони бо гӯшҳои харгӯш хурсандӣ карда истода, раққос, хурсандӣ кардан
👯‍♀	гӯшҳои харгӯш, занони бо гӯшҳои харгӯш хурсандӣ карда истода, занҳо, раққос, хурсандӣ кардан
🧖	сауна, шахсе дар ҳуҷраи буғ, ҳуҷраи буғ
🧖‍♂	марде дар ҳуҷраи буғ, сауна, ҳуҷраи буғ
🧖‍♀	зане дар ҳуҷраи буғ, сауна, ҳуҷраи буғ
🧗	кӯҳнавард, шахсе, ки баромада истодааст
🧗‍♂	кӯҳнавард, марде, ки баромада истодааст
🧗‍♀	зане, ки баромада истодааст, кӯҳнавард
🤺	шамшер, шамшербоз, шамшербозӣ, шахси шамшербозӣ карда истода
🏇	асп, аспдавонӣ, аспи пойга, пойга, човандоз
⛷️	барф, лижа, лижарон
🏂️	барф, лижа, сноуборд, сноубордист
🏌️	голф, тӯбча, шахсе, ки голф бозӣ карда истодааст
🏌‍♂	голф, мард, марде, ки голф бозӣ карда истодааст
🏌‍♀	голф, зан, зане, ки голф бозӣ карда истодааст
🏄️	серфинг, шахси серфинг карда истода
🏄‍♂	мард, марде, ки серфинг карда истодаастмард, серфинг
🏄‍♀	зан, зане, ки серфинг карда истодааст, серфинг
🚣	шахси қаиқронӣ карда истода, қаиқ, қаиқи белдор
🚣‍♂	мард, марди қаиқронӣ карда истода, қаиқ, қаиқи белдор
🚣‍♀	зан, зани қаиқронӣ карда истода, қаиқ, қаиқи белдор
🏊️	шахси шино карда истода, шино кардан
🏊‍♂	мард, марди шино карда истода, шино кардан
🏊‍♀	зан, зани шино карда истода, шино кардан
⛹️	тӯб, шахсе, ки тӯбро ба замин зада истодааст
⛹‍♂	мард, марде, ки тӯбро ба замин зада истодааст, тӯб
⛹‍♀	зан, зане, ки тӯбро ба замин зада истодааст, тӯб
🏋️	борбардор, вазн, шахсе, ки бор мебардорад
🏋‍♂	борбардор, мард, марде, ки бор мебардорад
🏋‍♀	борбардор, зан, зане, ки бор мебардорад
🚴	велосипед, велосипедрон, велосипедронӣ, шахси велосипедронӣ карда истода
🚴‍♂	велосипед, велосипедрон, велосипедронӣ, мард, марди велосипедронӣ карда истода
🚴‍♀	велосипед, велосипедрон, велосипедронӣ, зан, зани велосипедронӣ карда истода
🚵	велосипед, велосипедрон, куҳ, шахси дар куҳ велосипедронӣ карда истода
🚵‍♂	велосипед, велосипедрон, куҳ, мард, марди дар куҳ велосипедронӣ карда истода
🚵‍♀	велосипед, велосипедрон, велосипедронӣ, зан, зани дар куҳ велосипедронӣ карда истода, куҳ
🤸	гимнастика, чарх, шахси чарх зада истода
🤸‍♂	гимнастика, мард, марди чарх зада истода, чарх
🤸‍♀	гимнастика, зан, зани чарх зада истода, чарх
🤼	гуштин, гуштингир, нафарони гуштингирӣ карда истода
🤼‍♂	гуштин, мардон, мардон гуштингирӣ карда истодаанд
🤼‍♀	гуштин, занон, занон гуштингирӣ карда истодаанд
🤽	об, поло, шахси ватерполо бозӣ карда истода
🤽‍♂	ватерполо, мард, марди ватерполо бозӣ карда истода
🤽‍♀	ватерполо, зан, зани ватерполо бозӣ карда истода
🤾	гандбол, тӯб, шахси гандбол бозӣ карда истода
🤾‍♂	гандбол, мард, марди гандбол бозӣ карда истода
🤾‍♀	гандбол, зан, зани гандбол бозӣ карда истода
🤹	бисёрвазифавӣ, жонглёрӣ кардан, малака, тавозун, шахси жонглёрӣ карда истода
🤹‍♂	бисёрвазифавӣ, жонглёрӣ карда истода, мард, марди жонглёрӣ карда истода
🤹‍♀	бисёрвазифавӣ, жонглёрӣ карда истода, зан, зани жонглёрӣ карда истода
🧘	йога, медитатсия, шахси дар ҳолати лотус
🧘‍♂	йога, марди дар ҳолати лотус, медитатсия
🧘‍♀	зани дар ҳолати лотус, йога, медитатсия
🛀	ванна, нафаре, ки душ карда истодааст
🛌	меҳмонхона, одам дар бистар, хоб кардан
👭	даст, доштан, ду зане, ки дастҳои якдигарро дошта истодаанд, зан, ҷуфт
👫	даст, доштан, зан, мард, мард ва зане, ки дастҳои якдигарро дошта истодаанд, ҷуфт
👬	бурҷи дувоздаҳгона, даст, доштан, ду марде, ки дастҳои якдигарро дошта истодаанд, дугоник, мард, Ҷавзо, ҷуфт
💏	бӯса, ҷуфт
💑	муҳаббат, ҷуфт, ҷуфт бо дил
👪️	оила
🗣️	гап зада истода, гап задан, рӯй, сар, сари гап зада истода, суроб
👤	нимпайкара, нимпайкара дар суроб, суроб
👥	нимпайкара, нимпайкараҳо дар суроб, суроб
👣	изи пой, изҳои пой, либос, чоп кардан
🐵	маймун, рӯи маймун, рӯй
🐒	маймун
🦍	горилла
🐶	афти саг, рӯй, саг, ҳайвони хонагӣ
🐕️	саг, ҳайвони хонагӣ
🐩	пудел, саг
🐺	афти гург, гург, рӯй
🦊	афти рӯбоҳ, рӯбоҳ, рӯй
🐱	афти гурба, гурба, рӯй, ҳайвони хонагӣ
🐈️	гурба, ҳайвони хонагӣ
🦁	Асад, афти шер, бурҷи дувоздаҳгона, рӯй, шер
🐯	афти паланг, паланг, рӯй
🐅	паланг
🐆	леопард
🐴	асп, афти асп, рӯй
🐎	асп, аспакӣ, аспи пойга, пойга
🦄	афти якшоха, рӯй, якшоха
🦓	гӯрхар, рах
🦌	оҳу
🐮	афти гов, гов, рӯй
🐂	Савр, бурҷи дувоздаҳгона, буққа
🐃	говмеш, говмеши обӣ, об
🐄	гов
🐷	афти хук, рӯй, хук
🐖	коштан, хук
🐗	хук, хуки ваҳшӣ
🐽	бинии хук, бинӣ, рӯй, хук
🐏	бурҷи дувоздаҳгона, гӯсфанд, мард, қӯшқор, Ҳамал
🐑	гӯсфанд, зан, меш
🐐	буз, бурҷи дувоздаҳгона, Ҷадӣ
🐪	куҳон, шутур, яккуҳона
🐫	дукуҳона, куҳон, шутур, шутури дукуҳона
🦒	зарофа, нуқтаҳо
🐘	фил
🦏	карк
🐭	афти муш, муш, рӯй
🐁	муш
🐀	каламуш
🐹	афти миримушон, миримушон, рӯй, ҳайвони хонагӣ
🐰	афти заргӯш, заргӯш, рӯй, харгӯш, ҳайвони хонагӣ
🐇	заргӯш, харгӯш, ҳайвони хонагӣ
🐿️	бурундуқ
🦔	халанда, хорпушт
🦇	вампир, муши паррон
🐻	афти хирс, рӯй, хирс
🐨	коала, хирс
🐼	афти панда, панда, рӯй
🐾	из, изҳои панҷа, панҷа, пойҳо
🦃	мурғи марҷон, парранда
🐔	парранда, чӯҷа
🐓	парранда, хурӯс
🐣	аз тухм баромадан, кӯдак, парранда, чӯҷа, чӯҷаи аз тухм баромада истода
🐤	кӯдак, парранда, чӯҷа, чӯҷаи хурд
🐥	кӯдак, парранда, чӯҷа, чӯҷаи хурди ба тарафи пеш нигоҳ карда истода
🐦️	парранда
🐧	парранда, пингвин
🕊️	кафтар, паридан, парранда, сулҳ
🦅	парранда, уқоб
🦆	мурғобӣ, парранда
🦉	бум, парранда, хирадманд
🐸	афти қурбоққа, рӯй, қурбоққа
🐊	тимсоҳ
🐢	сангпушт, сангпушт обӣ, сангпушти даштӣ, сангпушти обӣ
🦎	калтакалос, хазанда
🐍	бурҷи дувоздаҳгона, доранда, мор, Ҳаввоъ
🐲	аждаҳор, афсона, афти аждаҳор, рӯй
🐉	аждаҳор, афсона
🦕	брахиозавр, бронтозавр, динозаври завропод, диплодок
🦖	Т-Рекс, Тираннозавр Рекс
🐳	наҳанг, наҳанги фаввора зада истода, рӯй, фаввора зада истода
🐋	наҳанг
🐬	делфин, қаноти моҳӣ
🐟️	бурҷи дувоздаҳгона, моҳӣ, Ҳут
🐠	моҳии тропикӣ, моҳӣ, тропикӣ
🐡	моҳӣ, сагмоҳӣ
🦈	кӯсамоҳӣ, моҳӣ
🐙	ҳаштпо
🐚	морпеч, садаф, садафи морпеч
🐌	тӯқумшуллуқ
🦋	зебо, шапалак, ҳашарот
🐛	гамбуск, ҳашарот
🐜	мурча, ҳашарот
🐝	занбур, занбури асал, ҳашарот
🐞	какана, нонхӯрак, халилихӯак, ҳасанак, ҳашарот
🦗	крикет, малах
🕷️	тортанак, ҳашарот
🕸️	тори тортанак, тортанак
🦂	Ақраб, бурҷи дувоздаҳгона, каждум
💐	Гулдаста, гул
🌸	гелос, гул, гул кардан, гули гелос
💮	гул, гули сафед
🏵️	гулдоира, растанӣ
🌹	гул, садбарг
🥀	гул, гули пажмурда, пажмурда
🌺	гибискус, гул
🌻	гул, офтоб, офтобпараст
🌼	гул, гул кардан
🌷	гул, лола
🌱	навниҳол, ҷавон
🌲	дарахт, дарахти ҳамешасабз
🌳	дарахт, дарахти паҳнбарг, паҳнбарг, резиш
🌴	дарахт, дарахти нахл, нахл
🌵	гули ханҷарӣ, растанӣ
🌾	биринҷ, гӯш, дарзаи биринҷ, дона
🌿	алаф, барг
☘️	растанӣ, себарга
🍀	4, барг, беда, бедаи чорбарга, чор
🍁	афтидан, барг, барги заранг, заранг
🍂	афтидан, барг, барги хазон
🍃	барг, барги дар шамол лаппида истода, лаппидан, пуф кардан, шамол
🍇	ангур, мева
🍈	мева, харбуза
🍉	мева, тарбуз
🍊	апелсин, мандарин, мева
🍋	лиму, мева, ситрусӣ
🍌	банан, мева
🍍	ананас, мева
🍎	мева, себ, себи сурх, сурх
🍏	мева, сабз, себ, себи сабз
🍐	мева, нок
🍑	мева, шафтолу
🍒	гелос, мева
🍓	буттамева, мева, тути заминӣ
🥝	киви, мева, меваи киви, ғизо
🍅	помидор, сабзавот, ғизо
🥥	нахл, норҷил, пина колада
🥑	авакадо, мева, ғизо
🍆	бодимҷон, бодинҷон, сабзавот
🥔	картошка, сабзавот, ғизо
🥕	сабзавот, сабзӣ, ғизо
🌽	гӯш, лабиринт, сӯтаи ҷуворимакка, ҷуворимакка, ҷуворӣ
🌶️	гарм, қаланфур, қаланфури тез
🥒	бодиринг, парварда, сабзавот, ғизо
🥦	брокколи, карами ёбоӣ
🍄	занбӯруғ, маргимагас
🥜	сабзавот, чормағз, чормағзи заминӣ, ғизо
🌰	кастона, растанӣ
🍞	буханка, нон
🥐	картошка бирён, кулчақанди "Рогалик", кулчақанди рогалик, нон, рогалик, ғизо
🥖	батон, картошкаи бирён, нон, нони дарози фаронсавӣ, ғизо
🥨	каҷ, кулчаи қоқи ҳалқашакл
🥞	пироги гарм, чалпак, чалпаки тунук, ғизо
🧀	панир, пораи фонашакли панир
🍖	гушт, гушт дар устухон, устухон
🍗	линги мурғ, мурғ, пой, устухон, чӯҷа
🥩	бурида, буридаи гушт, буридаи гушти баррача, буридаи гушти хук
🥓	гушт, гушти хук, ғизо
🍔	бургер, гамбургер
🍟	бирён, картошка бирён, фаронсавӣ
🍕	панир, питса, порча
🌭	хот дог, хотдог, ҳасиб, ҳасибча
🥪	нон, сендвич
🌮	мехиклӣ, тако
🌯	буритто, мехисоӣ, печондан
🥙	гирос, кабоб, нони чапотӣ, нони қима андохташуда, фалафел, ғизо, қима андохташуда
🥚	тухм, ғизо
🍳	бирён шудаистода, дег, пухта истодааст, тухм
🥘	дегча, дегчаи хурди ғизо, паеля, пастоб, тоба, ғизо
🍲	дег, деги ғизо, пазондан
🥣	наҳорӣ, табақ бо қошуқ, шӯла, шӯлаи биринҷӣ
🥗	сабз, хӯриш, хӯриши сабз, ғизо
🍿	ҷуворипақак
🥫	маҳсулоти консервагӣ, қуттӣ
🍱	бенто, қуттии бенто, қуттӣ
🍘	биринҷ, брекери биринҷӣ, крекер
🍙	биринҷ, курачаи биринҷӣ, тӯб, ҷопонӣ
🍚	биринҷ, биринҷи пухташуда, пухташуда
🍛	биринҷ, биринҷ бо карри, карри
🍜	дар об пӯхтан, зарф барои ҷӯшондан, коса, макарон, рамен
🍝	маҳсулоти макаронӣ, спагетти
🍠	картошка, картошкаи ширини пухташуда, пухташуда, ширин
🍢	кабоб, маҳсулоти баҳрӣ, оден, сихкабоб, чӯб
🍣	суши
🍤	бирён, креветка, креветкаи хурди бирён, криветкаи хурд, темпура
🍥	гирдоб, маҳсулоти қаннодӣ, моҳӣ, торт, торт аз моҳӣ бо гирдоб
🍡	данго, десерт, сихкабоб, чӯб, ширин, ҷопонӣ
🥟	гиёза, пирог, тушбера, чалпаки гуштдор, ғелаккабоб, ҷиёза
🥠	кулчаҳои қандини туҳфадор, пешгӯӣ
🥡	зарфи хӯрокхӯрии садафак, қуттии хӯроки бо худ гирифташаванда
🦀	Саратон, бурҷи дувоздаҳгона, харчанг
🦐	гамбусак, гамбусакча, моллюскҳо, хурд, ғизо
🦑	калмар, моллюск, ғизо
🍦	десерт, крем, мулоим, ширин, ях, яхмос, яхмоси мулоим
🍧	десерт, тарошаи ях, тарошида, ширин, ях
🍨	десерт, крем, ширин, ях, яхмос
🍩	десерт, кулча, ширин
🍪	десерт, кулчақанд, ширин
🎂	десерт, маҳсулоти қаннодӣ, рӯзи таваллуд, торт, торти зодрӯзӣ, ширин, ҷашн
🍰	десерт, кулчақанди регак-регак, маҳсулоти қаннодӣ, порча, торт, ширин
🥧	адвия, пирог, қаннодӣ
🍫	десерт, тахтача, ширин, шоколад, як тахтача шоколад
🍬	десерт, конфет, ширин
🍭	десерт, конфет, оби дандон, ширин
🍮	десерт, крем, пудинг, ширин
🍯	асал, дег, кӯзаи асал, ширин
🍼	кӯдак, нӯшидан, шир, шиша, шишаи кӯдак
🥛	нӯшидан, стакан, стакани шир, шир
☕️	гарм, нӯшидан, нӯшокии гарм, нӯшокӣ, чой, қаҳва, ҷӯшондан
🍵	нӯшидан, нӯшокӣ, пиёла, пиёлаи чой, пиёлаи чой бе даста, чой
🍶	бар, нӯшидан, нӯшокӣ, пиёла, саке, шиша
🍾	бар, нӯшидан, парида рафтан, пӯка, шиша, шиша бо пӯкаи он парида рафта истода
🍷	бар, май, нӯшидан, нӯшокӣ, стакан, стакани май
🍸️	бар, коктейл, нӯшидан, стакан, стакани коктейл
🍹	бар, нӯшидан, нӯшокии тропикӣ, тропикӣ
🍺	бар, дӯлча, дӯлчаи пиво, нӯшидан, пиво
🍻	бар, дӯлча, нӯшидан, пиво, ҷиринго задан, ҷирингос задани дӯлчаҳои пиво
🥂	нӯшидан, стакан, ҷашн гирифтан, ҷирингос задан, ҷирингос задани стаканҳо
🥃	виски, ликёр, стакан, стакан барои нӯшокиҳои спиртӣ, стакани хурд, тирпаронӣ
🥤	оби газдор, пиёла бо чӯбак, шарбат
🥢	чӯбҳои хӯрокхӯрӣ, ҳаши
🍽️	корд, пухтан, табақча, чангол, чангол ва корд бо табақча
🍴	корд, пухтан, чангол, чангол ва корд
🥄	зарфҳои хӯрокхӯрӣ, қошуқ
🔪	асбоб, корд, корди ошхона, пухтан, силоҳ, ҳочо
🏺	Далв, амфора, асбоб, бурҷи дувоздаҳгона, нӯшидан, пухта истода, силоҳ, қадаҳи дастадор
🌍	Аврупо, Африка, глобус, глобусе, ки Аврупо-Африкаро намоиш медиҳад, замин, ҷаҳон
🌎️	Америкаҳо, глобус, глобусе, ки Америкаҳоро намоиш медиҳад, замин, ҷаҳон
🌏	Австралия, Осиё, глобус, глобусе, ки Осиё-Австралияро намоиш медиҳад, замин, ҷаҳон
🌐	глобус, глобус бо меридианаҳо, замин, меридианҳо, ҷаҳон
🗺️	харита, харитаи ҷаҳон, ҷаҳон
🗾	харита, харитаи Ҷопон, Ҷопон
🏔️	барф, куҳ, куҳи бо барф пӯшида, хунук
⛰️	куҳ
🌋	вулқон, куҳ, оташфишонӣ
🗻	куҳ, теппаи Фуҷи, фуҷи
🏕️	хаймазанӣ
🏖️	соҳил, соҳил бо чатр, чатр
🏜️	биёбон
🏝️	биёбон, ҷазира, ҷазираи биёбон
🏞️	парк, парки миллӣ
🏟️	варзишгоҳ
🏛️	бинои классикӣ, классикӣ
🏗️	сохтмон, сохтмони бино
🏘️	хонаҳо
🏚️	бесоҳиб, хона, хонаи бесоҳиб
🏠️	хона
🏡	боғ, хона, хона бо боғ
🏢	бино, бинои идора
🏣	идораи почтаи ҷопонӣ, почта, ҷопонӣ
🏤	аврупоӣ, идораи почта, почта
🏥	беморхона, дору, духтур
🏦	бино, бонк
🏨	бино, меҳмонхона
🏩	меҳмонхона, меҳмонхонаи муҳаббат, муҳаббат
🏪	мағоза, мағозаи шабонарӯзӣ, шароит
🏫	бино, мактаб
🏬	бахш, магазин, универмаг
🏭️	бино, фабрика
🏯	қалъа, қалъаи ҷопонӣ, ҷопонӣ
🏰	аврупоӣ, қалъа
💒	калисои хурд, роман, тӯй
🗼	Токио, бурҷ, бурҷи Токио
🗽	озодӣ, ҳайкал, ҳайкали Озодӣ
⛪️	Насронӣ, дин, калисо, салиб
🕌	Ислом, дин, масҷид, мусулмон
🕍	дин, каниса, маъбад, яҳуд, яҳудӣ
⛩️	дин, синто, ҷои муқаддас, ҷои муқаддаси синто
🕋	Ислом, дин, каъба, мусулмон
⛲️	фаввора
⛺️	хайма, хаймазанӣ
🌁	туман, тумандор
🌃	ситора, шаб, шаби ситорадор
🏙️	манзараи шаҳр, шаҳр
🌄	Тулӯи офтоб аз болои куҳҳо, куҳ, офтоб, саҳар, тулӯи офтоб
🌅	офтоб, саҳар, тулӯъ
🌆	бегоҳ, манзара, манзараи шаҳр дар шом, офтоб, шаҳр, шом, ғуруби офтоб
🌇	офтоб, шом, ғуруб
🌉	кӯпрук, кӯпрук дар шаб, шаб
♨️	гарм, чашмаҳо, чашмаҳои гарм, ҷӯшидаистода
🎠	аспак, аспаки чархуфалак, чархуфалак
🎡	парки фароғатӣ, феррис, чарх, чархуфалак
🎢	каток, лағжишбозӣ, парки фароғатӣ, роҳи оҳани лағжишбозӣ
💈	мӯйгирӣ, сартарош, сутун бо ранги сурху сафеди морпеч, қутб
